### ISSUE TITLE
Strange timeout bug

### ISSUE THREAD

**Issue by 0xYUANTI** [http-kit/http-kit#98]
Hi,
my HTTP Kit client times out when talking to my HTTP Kit server.

=> @(org.httpkit.client/get "http://127.0.0.1:8080")
{:opts {:url "http://127.0.0.1:8080", :method :get}, :error #<TimeoutException org.httpkit.client.TimeoutException: connect timeout: 60000ms>}

I ran tshark, and it looks like the TCP connection is established correctly, but no actual HTTP packets are sent:

$ tshark -i lo0
500 9814.477637    127.0.0.1 -> 127.0.0.1    TCP 64 47058 > http-alt [SYN] Seq=0 Win=65535 Len=0 MSS=16344 WS=64 SACK_PERM=1 TSval=17329992 TSecr=0

501 9814.477659    127.0.0.1 -> 127.0.0.1    TCP 64 http-alt > 47058 [SYN, ACK] Seq=0 Ack=1 Win=65535 Len=0 MSS=16344 WS=64 SACK_PERM=1 TSval=531318717 TSecr=17329992

502 9814.477690    127.0.0.1 -> 127.0.0.1    TCP 56 47058 > http-alt [ACK] Seq=1 Ack=1 Win=81600 Len=0 TSval=17329992 TSecr=531318717

503 504 9874.478489    127.0.0.1 -> 127.0.0.1    TCP 56 47058 > http-alt [FIN, ACK] Seq=1 Ack=1 Win=81600 Len=0 TSval=17389992 TSecr=531318717

505 9874.478540    127.0.0.1 -> 127.0.0.1    TCP 56 http-alt > 47058 [ACK] Seq=1 Ack=2 Win=81600 Len=0 TSval=531378717 TSecr=17389992

506 9874.478683    127.0.0.1 -> 127.0.0.1    TCP 56 http-alt > 47058 [FIN, ACK] Seq=1 Ack=2 Win=81600 Len=0 TSval=531378717 TSecr=17389992

507 9874.478708    127.0.0.1 -> 127.0.0.1    TCP 56 47058 > http-alt [ACK] Seq=2 Ack=2 Win=81600 Len=0 TSval=17389992 TSecr=531378717

[I removed the nrepl chatter from the trace above.]

For the record, clj-http run from the same REPL works fine:

=> (clj-http.client/get "http://127.0.0.1:8080")
404 exception

Curl run from the local shell works fine too.
I don't really expect you to fix this, but let me know if there's any additional info you'd like.

System is:

FreeBSD 9.2 on EC2
OpenJDK 7
Clojure 1.5.1
Http-Kit 2.1.13
Ring 1.2.0

cheers,
-jakob
